{
  "input": {
    "message": "{\"EventTime\": \"2023-10-26 13:11:01\", \"Hostname\": \"hostname.example.org\", \"Keywords\": -9214364837600034816, \"EventType\": \"AUDIT_SUCCESS\", \"SeverityValue\": 2, \"Severity\": \"INFO\", \"EventID\": 6272, \"SourceName\": \"Microsoft-Windows-Security-Auditing\", \"ProviderGuid\": \"{54849625-5478-4994-A5BA-3E3B0328C30D}\", \"Version\": 2, \"Task\": 12552, \"OpcodeValue\": 0, \"RecordNumber\": 1674356873, \"ActivityID\": \"{0320A758-C2C2-0002-9DA7-2003C2C2D901}\", \"ProcessID\": 788, \"ThreadID\": 7392, \"Channel\": \"Security\", \"Message\": \"Network Policy Server granted access to a user.\\r\\n\\r\\nUser:\\r\\n\\tSecurity ID:\\t\\t\\tS-1-5-21-1111111111-2222222222-3333333333-44444\\r\\n\\tAccount Name:\\t\\t\\thost/l4523.example.org\\r\\n\\tAccount Domain:\\t\\t\\tEX1\\r\\n\\tFully Qualified Account Name:\\tEX1\\\\L4523\\r\\n\\r\\nClient Machine:\\r\\n\\tSecurity ID:\\t\\t\\tS-1-0-0\\r\\n\\tAccount Name:\\t\\t\\t-\\r\\n\\tFully Qualified Account Name:\\t-\\r\\n\\tCalled Station Identifier:\\t\\t0c-c2-6d-91-dd-25:Athos\\r\\n\\tCalling Station Identifier:\\t\\ta9-7c-7d-ac-47-67\\r\\n\\r\\nNAS:\\r\\n\\tNAS IPv4 Address:\\t\\t1.2.3.4\\r\\n\\tNAS IPv6 Address:\\t\\t-\\r\\n\\tNAS Identifier:\\t\\t\\tELEBEYCOBI\\r\\n\\tNAS Port-Type:\\t\\t\\tWireless - IEEE 802.11\\r\\n\\tNAS Port:\\t\\t\\t8\\r\\n\\r\\nRADIUS Client:\\r\\n\\tClient Friendly Name:\\t\\tELEBEYCOBI\\r\\n\\tClient IP Address:\\t\\t\\t1.2.3.4\\r\\n\\r\\nAuthentication Details:\\r\\n\\tConnection Request Policy Name:\\tSecure Wireless Connections\\r\\n\\tNetwork Policy Name:\\t\\tSecure Wifi Computer\\r\\n\\tAuthentication Provider:\\t\\tWindows\\r\\n\\tAuthentication Server:\\t\\tauth.example.org\\r\\n\\tAuthentication Type:\\t\\tPEAP\\r\\n\\tEAP Type:\\t\\t\\tMicrosoft: Secured password (EAP-MSCHAP v2)\\r\\n\\tAccount Session Identifier:\\t\\t111111111111111111111111111111111111111111111111111111111111111111\\r\\n\\tLogging Results:\\t\\t\\tAccounting information was written to the local log file.\\r\\n\", \"Category\": \"Network Policy Server\", \"Opcode\": \"Info\", \"SubjectUserSid\": \"S-1-5-21-1111111111-2222222222-3333333333-44444\", \"SubjectUserName\": \"host/l4523.example.org\", \"SubjectDomainName\": \"EX1\", \"FullyQualifiedSubjectUserName\": \"EX1\\\\L4523\", \"SubjectMachineSID\": \"S-1-0-0\", \"SubjectMachineName\": \"-\", \"FullyQualifiedSubjectMachineName\": \"-\", \"CalledStationID\": \"0c-c2-6d-91-dd-25:Athos\", \"CallingStationID\": \"a9-7c-7d-ac-47-67\", \"NASIPv4Address\": \"1.2.3.4\", \"NASIPv6Address\": \"-\", \"NASIdentifier\": \"ELEBEYCOBI\", \"NASPortType\": \"Wireless - IEEE 802.11\", \"NASPort\": \"8\", \"ClientName\": \"ELEBEYCOBI\", \"ClientIPAddress\": \"1.2.3.4\", \"ProxyPolicyName\": \"Secure Wireless Connections\", \"NetworkPolicyName\": \"Secure Wifi Computer\", \"AuthenticationProvider\": \"Windows\", \"AuthenticationServer\": \"auth.example.org\", \"AuthenticationType\": \"PEAP\", \"EAPType\": \"Microsoft: Secured password (EAP-MSCHAP v2)\", \"AccountSessionIdentifier\": \"111111111111111111111111111111111111111111111111111111111111111111\", \"LoggingResult\": \"Accounting information was written to the local log file.\", \"EventReceivedTime\": \"2023-10-26 13:11:01\", \"SourceModuleName\": \"eventlog\", \"SourceModuleType\": \"im_msvistalog\"}"
  },
  "expected": {
    "message": "{\"EventTime\": \"2023-10-26 13:11:01\", \"Hostname\": \"hostname.example.org\", \"Keywords\": -9214364837600034816, \"EventType\": \"AUDIT_SUCCESS\", \"SeverityValue\": 2, \"Severity\": \"INFO\", \"EventID\": 6272, \"SourceName\": \"Microsoft-Windows-Security-Auditing\", \"ProviderGuid\": \"{54849625-5478-4994-A5BA-3E3B0328C30D}\", \"Version\": 2, \"Task\": 12552, \"OpcodeValue\": 0, \"RecordNumber\": 1674356873, \"ActivityID\": \"{0320A758-C2C2-0002-9DA7-2003C2C2D901}\", \"ProcessID\": 788, \"ThreadID\": 7392, \"Channel\": \"Security\", \"Message\": \"Network Policy Server granted access to a user.\\r\\n\\r\\nUser:\\r\\n\\tSecurity ID:\\t\\t\\tS-1-5-21-1111111111-2222222222-3333333333-44444\\r\\n\\tAccount Name:\\t\\t\\thost/l4523.example.org\\r\\n\\tAccount Domain:\\t\\t\\tEX1\\r\\n\\tFully Qualified Account Name:\\tEX1\\\\L4523\\r\\n\\r\\nClient Machine:\\r\\n\\tSecurity ID:\\t\\t\\tS-1-0-0\\r\\n\\tAccount Name:\\t\\t\\t-\\r\\n\\tFully Qualified Account Name:\\t-\\r\\n\\tCalled Station Identifier:\\t\\t0c-c2-6d-91-dd-25:Athos\\r\\n\\tCalling Station Identifier:\\t\\ta9-7c-7d-ac-47-67\\r\\n\\r\\nNAS:\\r\\n\\tNAS IPv4 Address:\\t\\t1.2.3.4\\r\\n\\tNAS IPv6 Address:\\t\\t-\\r\\n\\tNAS Identifier:\\t\\t\\tELEBEYCOBI\\r\\n\\tNAS Port-Type:\\t\\t\\tWireless - IEEE 802.11\\r\\n\\tNAS Port:\\t\\t\\t8\\r\\n\\r\\nRADIUS Client:\\r\\n\\tClient Friendly Name:\\t\\tELEBEYCOBI\\r\\n\\tClient IP Address:\\t\\t\\t1.2.3.4\\r\\n\\r\\nAuthentication Details:\\r\\n\\tConnection Request Policy Name:\\tSecure Wireless Connections\\r\\n\\tNetwork Policy Name:\\t\\tSecure Wifi Computer\\r\\n\\tAuthentication Provider:\\t\\tWindows\\r\\n\\tAuthentication Server:\\t\\tauth.example.org\\r\\n\\tAuthentication Type:\\t\\tPEAP\\r\\n\\tEAP Type:\\t\\t\\tMicrosoft: Secured password (EAP-MSCHAP v2)\\r\\n\\tAccount Session Identifier:\\t\\t111111111111111111111111111111111111111111111111111111111111111111\\r\\n\\tLogging Results:\\t\\t\\tAccounting information was written to the local log file.\\r\\n\", \"Category\": \"Network Policy Server\", \"Opcode\": \"Info\", \"SubjectUserSid\": \"S-1-5-21-1111111111-2222222222-3333333333-44444\", \"SubjectUserName\": \"host/l4523.example.org\", \"SubjectDomainName\": \"EX1\", \"FullyQualifiedSubjectUserName\": \"EX1\\\\L4523\", \"SubjectMachineSID\": \"S-1-0-0\", \"SubjectMachineName\": \"-\", \"FullyQualifiedSubjectMachineName\": \"-\", \"CalledStationID\": \"0c-c2-6d-91-dd-25:Athos\", \"CallingStationID\": \"a9-7c-7d-ac-47-67\", \"NASIPv4Address\": \"1.2.3.4\", \"NASIPv6Address\": \"-\", \"NASIdentifier\": \"ELEBEYCOBI\", \"NASPortType\": \"Wireless - IEEE 802.11\", \"NASPort\": \"8\", \"ClientName\": \"ELEBEYCOBI\", \"ClientIPAddress\": \"1.2.3.4\", \"ProxyPolicyName\": \"Secure Wireless Connections\", \"NetworkPolicyName\": \"Secure Wifi Computer\", \"AuthenticationProvider\": \"Windows\", \"AuthenticationServer\": \"auth.example.org\", \"AuthenticationType\": \"PEAP\", \"EAPType\": \"Microsoft: Secured password (EAP-MSCHAP v2)\", \"AccountSessionIdentifier\": \"111111111111111111111111111111111111111111111111111111111111111111\", \"LoggingResult\": \"Accounting information was written to the local log file.\", \"EventReceivedTime\": \"2023-10-26 13:11:01\", \"SourceModuleName\": \"eventlog\", \"SourceModuleType\": \"im_msvistalog\"}",
    "event": {
      "code": "6272",
      "message": "Network Policy Server granted access to a user.\r\n\r\nUser:\r\n\tSecurity ID:\t\t\tS-1-5-21-1111111111-2222222222-3333333333-44444\r\n\tAccount Name:\t\t\thost/l4523.example.org\r\n\tAccount Domain:\t\t\tEX1\r\n\tFully Qualified Account Name:\tEX1\\L4523\r\n\r\nClient Machine:\r\n\tSecurity ID:\t\t\tS-1-0-0\r\n\tAccount Name:\t\t\t-\r\n\tFully Qualified Account Name:\t-\r\n\tCalled Station Identifier:\t\t0c-c2-6d-91-dd-25:Athos\r\n\tCalling Station Identifier:\t\ta9-7c-7d-ac-47-67\r\n\r\nNAS:\r\n\tNAS IPv4 Address:\t\t1.2.3.4\r\n\tNAS IPv6 Address:\t\t-\r\n\tNAS Identifier:\t\t\tELEBEYCOBI\r\n\tNAS Port-Type:\t\t\tWireless - IEEE 802.11\r\n\tNAS Port:\t\t\t8\r\n\r\nRADIUS Client:\r\n\tClient Friendly Name:\t\tELEBEYCOBI\r\n\tClient IP Address:\t\t\t1.2.3.4\r\n\r\nAuthentication Details:\r\n\tConnection Request Policy Name:\tSecure Wireless Connections\r\n\tNetwork Policy Name:\t\tSecure Wifi Computer\r\n\tAuthentication Provider:\t\tWindows\r\n\tAuthentication Server:\t\tauth.example.org\r\n\tAuthentication Type:\t\tPEAP\r\n\tEAP Type:\t\t\tMicrosoft: Secured password (EAP-MSCHAP v2)\r\n\tAccount Session Identifier:\t\t111111111111111111111111111111111111111111111111111111111111111111\r\n\tLogging Results:\t\t\tAccounting information was written to the local log file.\r\n",
      "outcome": "success",
      "provider": "Microsoft-Windows-Security-Auditing"
    },
    "action": {
      "id": 6272,
      "name": "Network Policy Server granted access to a user",
      "outcome": "success",
      "properties": {
        "AuthenticationProvider": "Windows",
        "AuthenticationServer": "auth.example.org",
        "AuthenticationType": "PEAP",
        "CallingStationID": "a9-7c-7d-ac-47-67",
        "Category": "Network Policy Server",
        "ClientIPAddress": "1.2.3.4",
        "ClientName": "ELEBEYCOBI",
        "EAPType": "Microsoft: Secured password (EAP-MSCHAP v2)",
        "EventType": "AUDIT_SUCCESS",
        "Keywords": "-9214364837600034816",
        "NASIdentifier": "ELEBEYCOBI",
        "NASPort": "8",
        "NASPortType": "Wireless - IEEE 802.11",
        "NetworkPolicyName": "Secure Wifi Computer",
        "OpcodeValue": 0,
        "ProviderGuid": "{54849625-5478-4994-A5BA-3E3B0328C30D}",
        "ProxyPolicyName": "Secure Wireless Connections",
        "Severity": "INFO",
        "SourceName": "Microsoft-Windows-Security-Auditing",
        "SubjectDomainName": "EX1",
        "SubjectUserName": "host/l4523.example.org",
        "SubjectUserSid": "S-1-5-21-1111111111-2222222222-3333333333-44444",
        "Task": 12552
      },
      "record_id": 1674356873,
      "type": "Security"
    },
    "destination": {
      "address": "auth.example.org",
      "domain": "auth.example.org",
      "registered_domain": "example.org",
      "size_in_char": 16,
      "subdomain": "auth",
      "top_level_domain": "org"
    },
    "host": {
      "hostname": "hostname.example.org",
      "name": "hostname.example.org"
    },
    "log": {
      "hostname": "hostname.example.org",
      "level": "info"
    },
    "os": {
      "family": "windows",
      "platform": "windows"
    },
    "process": {
      "id": 788,
      "pid": 788,
      "thread": {
        "id": 7392
      }
    },
    "related": {
      "hosts": [
        "auth.example.org",
        "hostname.example.org"
      ],
      "user": [
        "host/l4523.example.org"
      ]
    },
    "user": {
      "domain": "EX1",
      "id": "S-1-5-21-1111111111-2222222222-3333333333-44444",
      "name": "host/l4523.example.org"
    }
  }
}