{
  "input": {
    "message": "{\"Category\":\"Logon\",\"Channel\":\"Security\",\"EventID\":4625,\"EventType\":\"AUDIT_FAILURE\",\"Hostname\":\"test.test\",\"IpAddress\":\"1.2.3.4\",\"LogonProcessName\":\"Advapi  \",\"LogonType\":\"3\",\"Message\":\"An account failed to log on.\\r\\n\\r\\nSubject:\\r\\n\\tSecurity ID:\\t\\tS-1-5-18\\r\\n\\tAccount Name:\\t\\tTESTACCOUNTS$\\r\\n\\tAccount Domain:\\t\\tDOMAINNAME\\r\\n\\tLogon ID:\\t\\t0x3E7\\r\\n\\r\\nLogon Type:\\t\\t\\t3\\r\\n\\r\\nAccount For Which Logon Failed:\\r\\n\\tSecurity ID:\\t\\tS-1-0-0\\r\\n\\tAccount Name:\\t\\tTEST-USERNAME\\r\\n\\tAccount Domain:\\t\\tDOMAINNAME\\r\\n\\r\\nFailure Information:\\r\\n\\tFailure Reason:\\t\\tUnknown user name or bad password.\\r\\n\\tStatus:\\t\\t\\t0xC000006D\\r\\n\\tSub Status:\\t\\t0xC000006A\\r\\n\\r\\nProcess Information:\\r\\n\\tCaller Process ID:\\t0x25c\\r\\n\\tCaller Process Name:\\tC:\\\\Windows\\\\System32\\\\lsass.exe\\r\\n\\r\\nNetwork Information:\\r\\n\\tWorkstation Name:\\tTESTACCOUNTS\\r\\n\\tSource Network Address:\\t192.168.128.203\\r\\n\\tSource Port:\\t\\t41974\\r\\n\\r\\nDetailed Authentication Information:\\r\\n\\tLogon Process:\\t\\tAdvapi  \\r\\n\\tAuthentication Package:\\tMICROSOFT_AUTHENTICATION_PACKAGE_V1_0\\r\\n\\tTransited Services:\\t-\\r\\n\\tPackage Name (NTLM only):\\t-\\r\\n\\tKey Length:\\t\\t0\\r\\n\\r\\nThis event is generated when a logon request fails. It is generated on the computer where access was attempted.\\r\\n\\r\\nThe Subject fields indicate the account on the local system which requested the logon. This is most commonly a service such as the Server service, or a local process such as Winlogon.exe or Services.exe.\\r\\n\\r\\nThe Logon Type field indicates the kind of logon that was requested. The most common types are 2 (interactive) and 3 (network).\\r\\n\\r\\nThe Process Information fields indicate which account and process on the system requested the logon.\\r\\n\\r\\nThe Network Information fields indicate where a remote logon request originated. Workstation name is not always available and may be left blank in some cases.\\r\\n\\r\\nThe authentication information fields provide detailed information about this specific logon request.\\r\\n\\t- Transited services indicate which intermediate services have participated in this logon request.\\r\\n\\t- Package name indicates which sub-protocol was used among the NTLM protocols.\\r\\n\\t- Key length indicates the length of the generated session key. This will be 0 if no session key was requested.\",\"ProcessID\":604,\"ProcessName\":\"C:\\\\Windows\\\\System32\\\\lsass.exe\",\"Severity\":\"ERROR\",\"SourceName\":\"Microsoft-Windows-Security-Auditing\",\"SubjectDomainName\":\"DOMAINNAME\",\"SubjectLogonId\":\"0x3e7\",\"SubjectUserName\":\"TESTACCOUNTS$\",\"SubjectUserSid\":\"S-1-5-18\",\"TargetDomainName\":\"DOMAINNAME\",\"TargetUserName\":\"TEST-USERNAME\",\"sekoia.intake.windows\":\"xxxxxxxxxxxxxxxxxxxxxxxxxxxxxxxxx\"}"
  },
  "expected": {
    "message": "{\"Category\":\"Logon\",\"Channel\":\"Security\",\"EventID\":4625,\"EventType\":\"AUDIT_FAILURE\",\"Hostname\":\"test.test\",\"IpAddress\":\"1.2.3.4\",\"LogonProcessName\":\"Advapi  \",\"LogonType\":\"3\",\"Message\":\"An account failed to log on.\\r\\n\\r\\nSubject:\\r\\n\\tSecurity ID:\\t\\tS-1-5-18\\r\\n\\tAccount Name:\\t\\tTESTACCOUNTS$\\r\\n\\tAccount Domain:\\t\\tDOMAINNAME\\r\\n\\tLogon ID:\\t\\t0x3E7\\r\\n\\r\\nLogon Type:\\t\\t\\t3\\r\\n\\r\\nAccount For Which Logon Failed:\\r\\n\\tSecurity ID:\\t\\tS-1-0-0\\r\\n\\tAccount Name:\\t\\tTEST-USERNAME\\r\\n\\tAccount Domain:\\t\\tDOMAINNAME\\r\\n\\r\\nFailure Information:\\r\\n\\tFailure Reason:\\t\\tUnknown user name or bad password.\\r\\n\\tStatus:\\t\\t\\t0xC000006D\\r\\n\\tSub Status:\\t\\t0xC000006A\\r\\n\\r\\nProcess Information:\\r\\n\\tCaller Process ID:\\t0x25c\\r\\n\\tCaller Process Name:\\tC:\\\\Windows\\\\System32\\\\lsass.exe\\r\\n\\r\\nNetwork Information:\\r\\n\\tWorkstation Name:\\tTESTACCOUNTS\\r\\n\\tSource Network Address:\\t192.168.128.203\\r\\n\\tSource Port:\\t\\t41974\\r\\n\\r\\nDetailed Authentication Information:\\r\\n\\tLogon Process:\\t\\tAdvapi  \\r\\n\\tAuthentication Package:\\tMICROSOFT_AUTHENTICATION_PACKAGE_V1_0\\r\\n\\tTransited Services:\\t-\\r\\n\\tPackage Name (NTLM only):\\t-\\r\\n\\tKey Length:\\t\\t0\\r\\n\\r\\nThis event is generated when a logon request fails. It is generated on the computer where access was attempted.\\r\\n\\r\\nThe Subject fields indicate the account on the local system which requested the logon. This is most commonly a service such as the Server service, or a local process such as Winlogon.exe or Services.exe.\\r\\n\\r\\nThe Logon Type field indicates the kind of logon that was requested. The most common types are 2 (interactive) and 3 (network).\\r\\n\\r\\nThe Process Information fields indicate which account and process on the system requested the logon.\\r\\n\\r\\nThe Network Information fields indicate where a remote logon request originated. Workstation name is not always available and may be left blank in some cases.\\r\\n\\r\\nThe authentication information fields provide detailed information about this specific logon request.\\r\\n\\t- Transited services indicate which intermediate services have participated in this logon request.\\r\\n\\t- Package name indicates which sub-protocol was used among the NTLM protocols.\\r\\n\\t- Key length indicates the length of the generated session key. This will be 0 if no session key was requested.\",\"ProcessID\":604,\"ProcessName\":\"C:\\\\Windows\\\\System32\\\\lsass.exe\",\"Severity\":\"ERROR\",\"SourceName\":\"Microsoft-Windows-Security-Auditing\",\"SubjectDomainName\":\"DOMAINNAME\",\"SubjectLogonId\":\"0x3e7\",\"SubjectUserName\":\"TESTACCOUNTS$\",\"SubjectUserSid\":\"S-1-5-18\",\"TargetDomainName\":\"DOMAINNAME\",\"TargetUserName\":\"TEST-USERNAME\",\"sekoia.intake.windows\":\"xxxxxxxxxxxxxxxxxxxxxxxxxxxxxxxxx\"}",
    "event": {
      "action": "authentication_network",
      "category": [
        "authentication"
      ],
      "code": "4625",
      "message": "An account failed to log on.\r\n\r\nSubject:\r\n\tSecurity ID:\t\tS-1-5-18\r\n\tAccount Name:\t\tTESTACCOUNTS$\r\n\tAccount Domain:\t\tDOMAINNAME\r\n\tLogon ID:\t\t0x3E7\r\n\r\nLogon Type:\t\t\t3\r\n\r\nAccount For Which Logon Failed:\r\n\tSecurity ID:\t\tS-1-0-0\r\n\tAccount Name:\t\tTEST-USERNAME\r\n\tAccount Domain:\t\tDOMAINNAME\r\n\r\nFailure Information:\r\n\tFailure Reason:\t\tUnknown user name or bad password.\r\n\tStatus:\t\t\t0xC000006D\r\n\tSub Status:\t\t0xC000006A\r\n\r\nProcess Information:\r\n\tCaller Process ID:\t0x25c\r\n\tCaller Process Name:\tC:\\Windows\\System32\\lsass.exe\r\n\r\nNetwork Information:\r\n\tWorkstation Name:\tTESTACCOUNTS\r\n\tSource Network Address:\t192.168.128.203\r\n\tSource Port:\t\t41974\r\n\r\nDetailed Authentication Information:\r\n\tLogon Process:\t\tAdvapi  \r\n\tAuthentication Package:\tMICROSOFT_AUTHENTICATION_PACKAGE_V1_0\r\n\tTransited Services:\t-\r\n\tPackage Name (NTLM only):\t-\r\n\tKey Length:\t\t0\r\n\r\nThis event is generated when a logon request fails. It is generated on the computer where access was attempted.\r\n\r\nThe Subject fields indicate the account on the local system which requested the logon. This is most commonly a service such as the Server service, or a local process such as Winlogon.exe or Services.exe.\r\n\r\nThe Logon Type field indicates the kind of logon that was requested. The most common types are 2 (interactive) and 3 (network).\r\n\r\nThe Process Information fields indicate which account and process on the system requested the logon.\r\n\r\nThe Network Information fields indicate where a remote logon request originated. Workstation name is not always available and may be left blank in some cases.\r\n\r\nThe authentication information fields provide detailed information about this specific logon request.\r\n\t- Transited services indicate which intermediate services have participated in this logon request.\r\n\t- Package name indicates which sub-protocol was used among the NTLM protocols.\r\n\t- Key length indicates the length of the generated session key. This will be 0 if no session key was requested.",
      "outcome": "failure",
      "provider": "Microsoft-Windows-Security-Auditing",
      "reason": "Unknown user name or bad password.",
      "type": [
        "start"
      ]
    },
    "action": {
      "id": 4625,
      "name": "An account failed to log on",
      "outcome": "failure",
      "properties": {
        "Category": "Logon",
        "EventType": "AUDIT_FAILURE",
        "IpAddress": "1.2.3.4",
        "LogonProcessName": "Advapi  ",
        "LogonType": "3",
        "ProcessName": "C:\\Windows\\System32\\lsass.exe",
        "Severity": "ERROR",
        "SourceName": "Microsoft-Windows-Security-Auditing",
        "SubjectDomainName": "DOMAINNAME",
        "SubjectLogonId": "0x3e7",
        "SubjectUserName": "TESTACCOUNTS$",
        "SubjectUserSid": "S-1-5-18",
        "TargetDomainName": "DOMAINNAME",
        "TargetUserName": "TEST-USERNAME"
      },
      "type": "Security"
    },
    "host": {
      "hostname": "test",
      "name": "test.test"
    },
    "log": {
      "hostname": "test.test",
      "level": "error"
    },
    "os": {
      "family": "windows",
      "platform": "windows"
    },
    "process": {
      "executable": "C:\\Windows\\System32\\lsass.exe",
      "id": 604,
      "name": "lsass.exe",
      "pid": 604,
      "working_directory": "C:\\Windows\\System32\\"
    },
    "related": {
      "hosts": [
        "test"
      ],
      "ip": [
        "1.2.3.4"
      ],
      "user": [
        "TEST-USERNAME",
        "TESTACCOUNTS$"
      ]
    },
    "sekoiaio": {
      "authentication": {
        "process": {
          "name": "Advapi  "
        }
      },
      "client": {
        "name": "test.test",
        "os": {
          "type": "windows"
        }
      },
      "server": {
        "name": "test.test",
        "os": {
          "type": "windows"
        }
      }
    },
    "source": {
      "address": "1.2.3.4",
      "ip": "1.2.3.4"
    },
    "user": {
      "domain": "DOMAINNAME",
      "id": "S-1-5-18",
      "name": "TESTACCOUNTS$",
      "target": {
        "domain": "DOMAINNAME",
        "name": "TEST-USERNAME"
      }
    }
  }
}